{"$defs":{"card":{"properties":{"days":{"items":{"$ref":"#/$defs/day"},"type":"array"},"generated_at":{"$ref":"#/$defs/isoDateTime"},"kid":{"minLength":1,"type":"string"},"last_changed_at":{"anyOf":[{"$ref":"#/$defs/isoDateTime"},{"type":"null"}]},"notes":{"items":{"$ref":"#/$defs/note"},"type":"array"},"window":{"properties":{"end":{"$ref":"#/$defs/isoDate"},"start":{"$ref":"#/$defs/isoDate"}},"required":["start","end"],"type":"object"}},"required":["kid","generated_at","window","days","notes"],"type":"object"},"day":{"properties":{"date":{"$ref":"#/$defs/isoDate"},"entries":{"items":{"$ref":"#/$defs/entry"},"type":"array"},"label":{"minLength":1,"type":"string"},"with":{"enum":["Dad","Mom"],"type":"string"}},"required":["date","label","with","entries"],"type":"object"},"entry":{"properties":{"big":{"type":"boolean"},"changed":{"type":"boolean"},"changed_at":{"anyOf":[{"$ref":"#/$defs/isoDateTime"},{"type":"null"}]},"changed_note":{"type":["string","null"]},"date":{"$ref":"#/$defs/isoDate"},"end":{"$ref":"#/$defs/isoDateTime"},"id":{"minLength":1,"type":"string"},"legs":{"items":{"$ref":"#/$defs/leg"},"type":"array"},"place":{"type":["string","null"]},"start":{"$ref":"#/$defs/isoDateTime"},"time_label":{"type":"string"},"title":{"minLength":1,"type":"string"}},"required":["id","title","date","start","end","time_label","place","big","changed","changed_note","changed_at","legs"],"type":"object"},"isoDate":{"pattern":"^\\d{4}-\\d{2}-\\d{2}$","type":"string"},"isoDateTime":{"pattern":"^\\d{4}-\\d{2}-\\d{2}T\\d{2}:\\d{2}:\\d{2}(\\.\\d+)?(Z|[+-]\\d{2}:\\d{2})$","type":"string"},"leg":{"properties":{"driver":{"minLength":1,"type":"string"},"kind":{"enum":["dropoff","pickup"],"type":"string"},"time_label":{"type":"string"}},"required":["kind","driver","time_label"],"type":"object"},"manifest":{"properties":{"cards":{"items":{"pattern":"\\.json$","type":"string"},"minItems":1,"type":"array"},"generated_at":{"$ref":"#/$defs/isoDateTime"},"last_changed_at":{"anyOf":[{"$ref":"#/$defs/isoDateTime"},{"type":"null"}]}},"required":["cards","generated_at"],"type":"object"},"note":{"properties":{"date":{"anyOf":[{"$ref":"#/$defs/isoDate"},{"type":"null"}]},"from":{"type":["string","null"]},"sent_at":{"anyOf":[{"$ref":"#/$defs/isoDateTime"},{"type":"null"}]},"text":{"minLength":1,"type":"string"},"to":{"type":["string","null"]}},"required":["text"],"type":"object"}},"$id":"https://family-cards.example/cards.schema.json","$ref":"#/$defs/card","$schema":"https://json-schema.org/draft/2020-12/schema","description":"Validates the per-kid card JSON files (top level = the card schema) and, via #/$defs/manifest, manifest.json. Field set mirrors exactly what index.html consumes: kid, generated_at, last_changed_at, window, days[].entries[] (with big/changed/changed_note/changed_at and legs[]), notes[].","title":"Family Cards data files"}